product_id,username,rating,content,pros,cons,purchase_date,helpful_count,verified_purchase,user_level,tags
iphone_15_pro_256,科技爱好者001,5.0,拍照效果非常出色，A17 Pro芯片性能强劲，钛金属机身手感很好，续航也有明显提升。唯一缺点就是价格有点贵。,拍照好/性能强/外观漂亮/续航好,价格偏高/发热较明显,2024-01-20,45,是,VIP会员,拍照/性能/外观
iphone_15_pro_256,数码达人小王,4.5,整体体验很不错，系统流畅，拍照效果好。但是有时候玩游戏会有点发热，而且充电速度相比安卓还是慢了一些。,系统流畅/拍照好/外观精美,发热问题/充电慢,2024-02-01,23,是,普通会员,系统/拍照/游戏
iphone_15_pro_256,苹果忠实用户,5.0,不愧是旗舰机，各方面都很满意。Face ID解锁很快，灵动岛功能很有创意，USB-C接口终于换掉了。,功能全面/系统流畅/品质保证,无明显缺点,2024-02-15,67,是,VIP会员,品质/功能/系统
xiaomi14_256,小米粉丝007,4.0,性价比很高，徕卡相机确实不错，屏幕显示效果也很好。但是MIUI系统还是有一些广告，希望能再优化一下。,性价比高/拍照好/屏幕好,系统广告/发热问题,2024-02-10,18,是,普通会员,性价比/拍照/屏幕
xiaomi14_256,学生党小张,4.5,作为学生党，这款手机很实用。配置够用，价格也能接受。充电速度很快，但是续航一般。,性价比高/充电快/配置够用,续航一般/系统优化,2024-02-25,12,是,新会员,性价比/学生/充电
huawei_p60_pro,花粉老李,5.0,华为的拍照技术真是没得说，特别是夜景拍摄。鸿蒙系统也很流畅，就是4G网络有点遗憾。,拍照优秀/系统流畅/外观精美,4G网络/价格偏高,2024-02-05,34,是,VIP会员,拍照/系统/华为
macbook_air_m2,设计师小刘,5.0,M2芯片性能很强劲，用来做设计工作完全够用。屏幕显示效果好，续航也不错，就是接口有点少。,性能强劲/屏幕好/续航好,接口少/价格高,2024-01-25,56,是,VIP会员,设计/性能/屏幕
macbook_air_m2,程序员小王,4.5,开发用很舒服，macOS系统很稳定，编译速度快。但是内存8GB有时候会不够用，建议选择16GB版本。,系统稳定/性能好/屏幕舒适,内存偏小/接口少,2024-02-10,28,是,普通会员,编程/性能/系统
ipad_air_5,艺术家小美,4.0,画画用很不错，M1芯片够用，Apple Pencil体验很好。但是64GB存储有点小，而且没有高刷屏。,画画好/性能够用/轻薄便携,存储小/无高刷,2024-02-08,19,是,普通会员,艺术/绘画/便携
apple_watch_s9,运动达人001,4.5,运动监测功能很全面，心率监测准确，续航比上一代有提升。但是表带需要另外购买，而且有些功能需要付费。,运动功能全/监测准确/续航提升,表带另购/功能付费,2024-02-12,22,是,VIP会员,运动/健康/监测
airpods_pro_2,音乐爱好者007,5.0,降噪效果很棒，音质也很好，空间音频功能很赞。USB-C充电很方便，就是价格有点贵。,降噪好/音质佳/空间音频,价格偏高,2024-02-18,41,是,普通会员,音乐/降噪/音质
xiaomi_pad_6,学生党小李,4.0,看视频学习用很合适，屏幕显示效果不错，价格也实惠。但是系统优化还有提升空间，有些应用适配不够好。,性价比高/屏幕好/价格实惠,系统优化/应用适配,2024-03-01,15,是,新会员,学习/视频/性价比
huawei_freebuds,商务人士张总,4.5,降噪效果很好，通话质量清晰，佩戴舒适。但是有时候连接会不稳定，而且价格偏贵。,降噪好/通话清晰/佩戴舒适,连接不稳/价格偏高,2024-02-20,17,是,VIP会员,商务/降噪/通话
samsung_s24,安卓玩家小刘,3.5,屏幕显示效果很好，120Hz刷新率很流畅。但是续航一般，而且One UI系统有些臃肿。,屏幕好/流畅度好/S Pen实用,续航一般/系统臃肿,2024-02-25,9,是,普通会员,屏幕/流畅度/安卓
lenovo_yoga,办公白领小美,4.0,触控屏很实用，键盘手感好，适合办公。但是重量有点大，而且价格偏贵。,触控好/键盘舒适/办公实用,重量大/价格偏高,2024-03-05,13,是,普通会员,办公/触控/键盘
vivo_x100,摄影爱好者008,4.5,蔡司相机真的很赞，拍照效果出色，特别是人像模式。但是系统优化还有提升空间。,拍照好/人像佳/外观漂亮,系统优化/续航一般,2024-03-10,16,是,VIP会员,摄影/拍照/人像
oppo_find_x7,颜值控小张,4.0,外观设计很漂亮，哈苏相机拍照效果不错。但是性价比不如小米，而且充电速度一般。,外观漂亮/拍照好/品牌好,性价比一般/充电一般,2024-03-15,11,是,普通会员,外观/拍照/品牌
huawei_mate60,爱国者老王,5.0,支持国产，麒麟芯片回归，卫星通信功能很实用。系统流畅，拍照也不错，就是价格有点高。,国产芯片/卫星通信/系统流畅,价格偏高,2024-02-28,38,是,VIP会员,国产/华为/爱国
xiaomi_redmibook_pro,程序员小李,4.0,配置很高，屏幕显示效果好，适合编程。但是重量有点大，而且续航一般。,配置高/屏幕好/编程适用,重量大/续航一般,2024-03-20,14,是,普通会员,编程/配置/屏幕
huawei_matebook,商务人士李总,4.5,超级终端功能很实用，触控屏体验很好，做工精良。但是价格偏高，而且软件生态有待完善。,超级终端/触控好/做工精良,价格偏高/软件生态,2024-03-25,21,是,VIP会员,商务/办公/华为
dell_xps,设计师小王,4.0,屏幕边框很窄，显示效果很好，轻薄便携。但是接口很少，而且价格偏贵。,屏幕好/轻薄便携/边框窄,接口少/价格偏高,2024-04-01,12,是,普通会员,设计/屏幕/便携
samsung_tab_s9,影音爱好者007,4.5,AMOLED屏幕显示效果很棒，S Pen手写体验很好。但是价格偏高，而且续航一般。,屏幕好/S Pen实用/显示效果,价格偏高/续航一般,2024-04-05,18,是,VIP会员,影音/屏幕/娱乐
xiaomi_watch_s3,运动达人小张,3.5,外观设计很好看，运动模式很丰富。但是续航不如华为GT4，而且有些功能不够精确。,外观好/运动模式多,续航一般/精度问题,2024-04-10,8,是,新会员,运动/外观/健康
galaxy_watch6,三星粉丝小刘,4.0,圆形表盘很好看，健康监测功能全面。但是续航一般，而且有些功能需要三星手机才能用。,外观好看/健康监测全,续航一般/兼容性差,2024-04-15,10,是,普通会员,三星/健康/外观
sony_wh1000xm5,音质控小美,5.0,音质非常好，降噪效果一流，佩戴舒适。就是价格很贵，而且有点重。,音质极佳/降噪一流/舒适,价格贵/重量大,2024-04-20,25,是,VIP会员,音质/降噪/音乐
galaxy_buds2_3,科技爱好者小王,4.0,24bit音质很不错，360度音频效果很好。但是续航一般，而且价格偏高。,音质好/360度音频,续航一般/价格偏高,2024-04-25,7,是,普通会员,音质/三星/音频